{
  "schema_version": 2,
  "source_kind": "nvapi_therm_channel_v2_observation",
  "capture_session_id": "00000000-0000-4000-8000-000000000001",
  "capture_started_utc": "2026-08-26T21:18:30.0000000Z",
  "captured_utc": "2026-08-26T21:18:42.0000000Z",
  "duration_seconds": 12,
  "process_id": 1234,
  "profile": {
    "profile_name": "gpuz-2.70.0-nvapi-610.88-therm-channel-status-v2",
    "gpu": {
      "name": "NVIDIA GeForce RTX 3060",
      "uuid": "GPU-11111111-2222-3333-4444-555555555555",
      "driver_version": "610.88",
      "nvml_version": "13.610.88",
      "pci_bus_id": "00000000:01:00.0",
      "pci_vendor_id": "0x10de",
      "pci_device_id": "0x2504",
      "pci_subsystem_vendor_id": "0x10de",
      "pci_subsystem_device_id": "0x1536",
      "vbios_version": "94.06.25.00.fc"
    },
    "identity_probe_sha256": "1111111111111111111111111111111111111111111111111111111111111111",
    "gpuz_sha256": "6cb0ef29682452de81a9576808881685161411a1fad00938ba04131159979c29",
    "debugger_sha256": "2222222222222222222222222222222222222222222222222222222222222222",
    "debugger_file_version": "10.0.26100.1",
    "candidate_inventory_sha256": "3aaada9b367dacca7cf74511bae8532bd79b7f8bd06b9bb609056f3d9da1f1d7",
    "prior_observation_sha256": "c7a63df5e6a30bccbba5ad8c1a62a9251c40d512cd74060e69e043cfc54f77b3",
    "nvapi_module_sha256": "fbc9aed43bfa5bda19b7f83a809a081a0ce454b6d6003dcabc565ecb3e6afdaf",
    "loaded_nvapi_module": {
      "module_name": "nvapi_impl.dll",
      "proof_command": "lmv m nvapi_impl",
      "file_sha256": "fbc9aed43bfa5bda19b7f83a809a081a0ce454b6d6003dcabc565ecb3e6afdaf",
      "mapped_start": "0x68fe0000",
      "mapped_end_exclusive": "0x694d5000",
      "mapped_size_bytes": 5197824
    },
    "interface_id": "0x65fe3aad",
    "function_rva": "0x001ad310",
    "caller_module_name": "GPU-Z.exe",
    "caller_rva": "0x002225b5",
    "buffer_ebp_displacement_bytes": -172,
    "structure_version": "0x000200a8",
    "structure_size_bytes": 168,
    "fixed_point_fractional_bits": 8,
    "value_word_indices": [
      10,
      11
    ]
  },
  "references": {
    "gpuz": {
      "file_name": "gpuz-therm-channel-reference-v2.csv",
      "sealed_relative_path": "gpuz-therm-channel-reference-v2.csv",
      "prefix_sha256": "fa1467f02d113cd02f608e0535049ae76078560e9b59bf7f435cbfc4678df23a",
      "prefix_size_bytes": 476,
      "size_bytes_before": 100,
      "size_bytes_midpoint": 190,
      "size_bytes_after": 476,
      "last_write_utc_before": "2026-08-26T21:18:31.0000000Z",
      "last_write_utc_midpoint": "2026-08-26T21:18:32.0000000Z",
      "last_write_utc_after": "2026-08-26T21:18:33.0000000Z",
      "last_sample_local_before": "2026-08-26 18:18:31",
      "last_sample_local_midpoint": "2026-08-26 18:18:32",
      "last_sample_local_after": "2026-08-26 18:18:33",
      "grew_during_capture": true
    }
  },
  "call_count": 6,
  "samples": [
    {
      "sequence": 1,
      "thread_id": "0x00001234",
      "caller_rva": "0x002225b5",
      "channel_index": 0,
      "return_status": "0x00000000",
      "structure_version": "0x000200a8",
      "channel_mask": "0x00000001",
      "raw_words": [
        "0x000200a8",
        "0x00000001",
        "0x00000000",
        "0x00000000",
        "0x00000000",
        "0x00000000",
        "0x00000000",
        "0x00000000",
        "0x00000000",
        "0x00000000",
        "0x00002800",
        "0x00000000",
        "0x00000000",
        "0x00000000",
        "0x00000000",
        "0x00000000",
        "0x00000000",
        "0x00000000",
        "0x00000000",
        "0x00000000",
        "0x00000000",
        "0x00000000",
        "0x00000000",
        "0x00000000",
        "0x00000000",
        "0x00000000",
        "0x00000000",
        "0x00000000",
        "0x00000000",
        "0x00000000",
        "0x00000000",
        "0x00000000",
        "0x00000000",
        "0x00000000",
        "0x00000000",
        "0x00000000",
        "0x00000000",
        "0x00000000",
        "0x00000000",
        "0x00000000",
        "0x00000000",
        "0x00000000"
      ],
      "selected_word_index": 10,
      "selected_raw_fixed_8": 10240,
      "selected_celsius": 40
    },
    {
      "sequence": 2,
      "thread_id": "0x00001234",
      "caller_rva": "0x002225b5",
      "channel_index": 1,
      "return_status": "0x00000000",
      "structure_version": "0x000200a8",
      "channel_mask": "0x00000002",
      "raw_words": [
        "0x000200a8",
        "0x00000002",
        "0x00000000",
        "0x00000000",
        "0x00000000",
        "0x00000000",
        "0x00000000",
        "0x00000000",
        "0x00000000",
        "0x00000000",
        "0x00000000",
        "0x00003200",
        "0x00000000",
        "0x00000000",
        "0x00000000",
        "0x00000000",
        "0x00000000",
        "0x00000000",
        "0x00000000",
        "0x00000000",
        "0x00000000",
        "0x00000000",
        "0x00000000",
        "0x00000000",
        "0x00000000",
        "0x00000000",
        "0x00000000",
        "0x00000000",
        "0x00000000",
        "0x00000000",
        "0x00000000",
        "0x00000000",
        "0x00000000",
        "0x00000000",
        "0x00000000",
        "0x00000000",
        "0x00000000",
        "0x00000000",
        "0x00000000",
        "0x00000000",
        "0x00000000",
        "0x00000000"
      ],
      "selected_word_index": 11,
      "selected_raw_fixed_8": 12800,
      "selected_celsius": 50
    },
    {
      "sequence": 3,
      "thread_id": "0x00001234",
      "caller_rva": "0x002225b5",
      "channel_index": 0,
      "return_status": "0x00000000",
      "structure_version": "0x000200a8",
      "channel_mask": "0x00000001",
      "raw_words": [
        "0x000200a8",
        "0x00000001",
        "0x00000000",
        "0x00000000",
        "0x00000000",
        "0x00000000",
        "0x00000000",
        "0x00000000",
        "0x00000000",
        "0x00000000",
        "0x00002900",
        "0x00000000",
        "0x00000000",
        "0x00000000",
        "0x00000000",
        "0x00000000",
        "0x00000000",
        "0x00000000",
        "0x00000000",
        "0x00000000",
        "0x00000000",
        "0x00000000",
        "0x00000000",
        "0x00000000",
        "0x00000000",
        "0x00000000",
        "0x00000000",
        "0x00000000",
        "0x00000000",
        "0x00000000",
        "0x00000000",
        "0x00000000",
        "0x00000000",
        "0x00000000",
        "0x00000000",
        "0x00000000",
        "0x00000000",
        "0x00000000",
        "0x00000000",
        "0x00000000",
        "0x00000000",
        "0x00000000"
      ],
      "selected_word_index": 10,
      "selected_raw_fixed_8": 10496,
      "selected_celsius": 41
    },
    {
      "sequence": 4,
      "thread_id": "0x00001234",
      "caller_rva": "0x002225b5",
      "channel_index": 1,
      "return_status": "0x00000000",
      "structure_version": "0x000200a8",
      "channel_mask": "0x00000002",
      "raw_words": [
        "0x000200a8",
        "0x00000002",
        "0x00000000",
        "0x00000000",
        "0x00000000",
        "0x00000000",
        "0x00000000",
        "0x00000000",
        "0x00000000",
        "0x00000000",
        "0x00000000",
        "0x00003300",
        "0x00000000",
        "0x00000000",
        "0x00000000",
        "0x00000000",
        "0x00000000",
        "0x00000000",
        "0x00000000",
        "0x00000000",
        "0x00000000",
        "0x00000000",
        "0x00000000",
        "0x00000000",
        "0x00000000",
        "0x00000000",
        "0x00000000",
        "0x00000000",
        "0x00000000",
        "0x00000000",
        "0x00000000",
        "0x00000000",
        "0x00000000",
        "0x00000000",
        "0x00000000",
        "0x00000000",
        "0x00000000",
        "0x00000000",
        "0x00000000",
        "0x00000000",
        "0x00000000",
        "0x00000000"
      ],
      "selected_word_index": 11,
      "selected_raw_fixed_8": 13056,
      "selected_celsius": 51
    },
    {
      "sequence": 5,
      "thread_id": "0x00001234",
      "caller_rva": "0x002225b5",
      "channel_index": 0,
      "return_status": "0x00000000",
      "structure_version": "0x000200a8",
      "channel_mask": "0x00000001",
      "raw_words": [
        "0x000200a8",
        "0x00000001",
        "0x00000000",
        "0x00000000",
        "0x00000000",
        "0x00000000",
        "0x00000000",
        "0x00000000",
        "0x00000000",
        "0x00000000",
        "0x00002a00",
        "0x00000000",
        "0x00000000",
        "0x00000000",
        "0x00000000",
        "0x00000000",
        "0x00000000",
        "0x00000000",
        "0x00000000",
        "0x00000000",
        "0x00000000",
        "0x00000000",
        "0x00000000",
        "0x00000000",
        "0x00000000",
        "0x00000000",
        "0x00000000",
        "0x00000000",
        "0x00000000",
        "0x00000000",
        "0x00000000",
        "0x00000000",
        "0x00000000",
        "0x00000000",
        "0x00000000",
        "0x00000000",
        "0x00000000",
        "0x00000000",
        "0x00000000",
        "0x00000000",
        "0x00000000",
        "0x00000000"
      ],
      "selected_word_index": 10,
      "selected_raw_fixed_8": 10752,
      "selected_celsius": 42
    },
    {
      "sequence": 6,
      "thread_id": "0x00001234",
      "caller_rva": "0x002225b5",
      "channel_index": 1,
      "return_status": "0x00000000",
      "structure_version": "0x000200a8",
      "channel_mask": "0x00000002",
      "raw_words": [
        "0x000200a8",
        "0x00000002",
        "0x00000000",
        "0x00000000",
        "0x00000000",
        "0x00000000",
        "0x00000000",
        "0x00000000",
        "0x00000000",
        "0x00000000",
        "0x00000000",
        "0x00003400",
        "0x00000000",
        "0x00000000",
        "0x00000000",
        "0x00000000",